_id,question,choices[0],choices[1],choices[2],choices[3],answer,score,User_answer
657ab460d4c6d4a4aa603e16,Python의 생성자 함수 이름은 무엇인가요?,__init__,__main__,__str__,__del__,__init__,20,2
657ab460d4c6d4a4aa603e17,"Python에서 'Hello, World!'를 출력하는 코드는 무엇인가요?","print('Hello, World!')","console.log('Hello, World!')","printf('Hello, World!')","echo 'Hello, World!'","print('Hello, World!')",20,2
657ab460d4c6d4a4aa603e18,Python의 주석을 나타내는 기호는 무엇인가요?,//,/* */,#,--,#,20,1
657ab460d4c6d4a4aa603e19,Python에서 리스트의 길이를 반환하는 함수는 무엇인가요?,size(),length(),len(),sizeof(),len(),20,2
657ab460d4c6d4a4aa603e1a,Python에서 문자열을 숫자로 변환하는 함수는 무엇인가요?,str(),int(),char(),float(),int(),20,4
